{
  "$schema": "https://json-schema.org/draft/2020-12/schema",
  "$id": "https://rpg-chronicle.local/schema/benchmark-manifest-0.1.json",
  "title": "RPG Chronicle benchmark manifest",
  "type": "object",
  "additionalProperties": false,
  "required": [
    "schema_version",
    "id",
    "title",
    "corpus_tier",
    "source",
    "excerpt",
    "recording_conditions",
    "references",
    "truth",
    "rights",
    "selection"
  ],
  "properties": {
    "schema_version": {"const": "0.1"},
    "id": {"type": "string", "pattern": "^[a-z0-9]+(?:-[a-z0-9]+)*$"},
    "title": {"type": "string", "minLength": 1},
    "corpus_tier": {
      "type": "string",
      "enum": [
        "polished_professional",
        "amateur_online",
        "single_room_single_microphone",
        "controlled_or_synthetic",
        "multi_hour_stress"
      ]
    },
    "source": {
      "type": "object",
      "additionalProperties": false,
      "required": ["landing_url", "media_url", "publisher", "published_at", "accessed_at"],
      "properties": {
        "landing_url": {"type": "string", "format": "uri", "pattern": "^https?://"},
        "media_url": {"type": "string", "format": "uri", "pattern": "^https?://"},
        "publisher": {"type": "string", "minLength": 1},
        "published_at": {"type": "string", "format": "date"},
        "accessed_at": {"type": "string", "format": "date"},
        "episode_duration_ms": {"type": "integer", "minimum": 1},
        "media_bytes": {
          "type": "integer",
          "minimum": 1,
          "description": "Size of the published media file, as fetched on accessed_at."
        },
        "media_sha256": {
          "type": "string",
          "pattern": "^[0-9a-f]{64}$",
          "description": "SHA-256 of the published media file. A fetch that reproduces this digest reproduces the excerpt; see scripts/fetch_benchmark_media.py."
        },
        "content_fingerprint": {
          "type": "object",
          "additionalProperties": false,
          "required": ["method", "path", "sha256"],
          "description": "How to establish that another copy is this recording, when bytes cannot: a source that re-encodes gives every downloader a different file, so a digest pins nothing. The fingerprint describes the sound instead, and survives re-encoding. Verified truth needs one of the two, because an anchor into bytes nobody can confirm is not evidence.",
          "properties": {
            "method": {
              "type": "string",
              "minLength": 1,
              "description": "Identifies the procedure and its version, so a reader knows which tool reads this file."
            },
            "path": {
              "type": "string",
              "minLength": 1,
              "pattern": "^(?!/)(?!.*(?:^|/)\\.\\.(?:/|$)).+$",
              "description": "Repository path of the committed fingerprint, relative to the repository root. Constrained here as well as in the validator: a manifest is data, and a path with a leading slash or a .. segment would send whatever reads it outside the repository, which both reads what it should not and voids the point of the field - that the fingerprint is committed where a reader can already see it."
            },
            "sha256": {
              "type": "string",
              "pattern": "^[0-9a-f]{64}$",
              "description": "SHA-256 of the fingerprint file itself. This one does pin bytes: the fingerprint is committed here, so it cannot be re-encoded underneath a reader."
            }
          }
        }
      }
    },
    "excerpt": {
      "type": "object",
      "additionalProperties": false,
      "required": ["start_ms", "end_ms", "timestamp_basis"],
      "properties": {
        "start_ms": {"type": "integer", "minimum": 0},
        "end_ms": {"type": "integer", "minimum": 1},
        "timestamp_basis": {
          "type": "string",
          "enum": ["publisher_player", "published_media_file", "third_party_index"]
        },
        "verification": {"type": "string", "minLength": 1}
      }
    },
    "recording_conditions": {
      "type": "object",
      "additionalProperties": false,
      "required": [
        "capture_layout",
        "production",
        "expected_physical_speakers",
        "overlap",
        "music_or_effects",
        "observations"
      ],
      "properties": {
        "capture_layout": {
          "type": "string",
          "enum": [
            "studio_multimic",
            "remote_multitrack",
            "single_mixed_track",
            "single_room_mic",
            "unknown"
          ],
          "description": "How the speakers were captured, stated only as far as the recording establishes it. single_mixed_track says what a mixdown measurably is - one track, no per-speaker channel to diarize from - and deliberately claims nothing about where the speakers were, since room topology is rarely measurable from a published file. Where the speakers actually were belongs in observations, with its evidence, rather than in an enum a consumer will read alone."
        },
        "production": {"type": "string", "enum": ["polished", "edited", "raw", "unknown"]},
        "expected_physical_speakers": {
          "type": ["integer", "null"],
          "minimum": 1,
          "description": "The upper reading of how many people speak: distinct speaking roles heard, before allowing for one person covering two of them. Read it with proven_distinct_speakers, which is the floor; the true count lies between."
        },
        "proven_distinct_speakers": {
          "type": ["integer", "null"],
          "minimum": 1,
          "description": "How many speakers are demonstrably different people, by evidence stated in observations. Never larger than expected_physical_speakers. Proving k distinct people needs k speakers established as pairwise distinct from one another: counting the speakers named across a list of pairwise observations overstates it, because a chain of pairs can be satisfied by two people. A diarization score should be read against this floor as well as the estimate."
        },
        "overlap": {"type": "string", "enum": ["low", "medium", "high", "unknown"]},
        "music_or_effects": {
          "type": ["boolean", "null"],
          "description": "Whether music or effects appear in the recording. null means the question was not answered, which covers both cases the corpus uses it for: a candidate ruled out on rights before anyone listened, and a recording assessed only by sampling. false claims an end-to-end inspection, so use it only when one was done."
        },
        "observations": {"type": "string", "minLength": 1}
      }
    },
    "references": {
      "type": "object",
      "additionalProperties": false,
      "required": ["caption_or_transcript", "speaker_labels", "annotation_status"],
      "properties": {
        "caption_or_transcript": {
          "type": "string",
          "enum": ["publisher", "community", "automatic", "none", "unknown"]
        },
        "reference_url": {"type": "string", "format": "uri"},
        "speaker_labels": {"type": "boolean"},
        "annotation_status": {
          "type": "string",
          "enum": ["none", "provisional", "verified"],
          "description": "How far this item's own truth layer has got. verified means every target met the bar the corpus sets for verification - anchored, with evidence, from an observation of the recording - and it deliberately does not distinguish a human ear from tooling, because that distinction lives per target in basis and per item in truth.method. Read alone this enum therefore reads stronger than some items' evidence: an item can be verified with no audio_observed target anywhere in it. Anything deciding what a score means has to read truth.method, and anything reporting one has to say which."
        }
      }
    },
    "truth": {
      "type": "object",
      "additionalProperties": false,
      "required": ["important_entities", "important_events", "notes"],
      "properties": {
        "important_entities": {
          "type": "array",
          "items": {"$ref": "#/$defs/truthTarget"}
        },
        "important_events": {
          "type": "array",
          "items": {"$ref": "#/$defs/truthTarget"}
        },
        "notes": {"type": "string"},
        "threads": {
          "type": "array",
          "description": "Subjects that open early and are still live late, recorded as the distance between the first and last anchor that carries them. This is the property a short excerpt cannot exhibit at all, and the reason a multi-hour item exists: a system can capture every entity in a four-hour session and still fail to notice that the thing settled in the last ten minutes is the thing raised in the first ten. Each end must be the anchor of a truth target, so a thread cannot be asserted without the observations that hold it up.",
          "items": {"$ref": "#/$defs/truthThread"}
        },
        "method": {
          "type": "string",
          "minLength": 1,
          "description": "How the truth was established, including which provider produced any machine-assisted output. Required once any target is verified, so a score is never read without its annotation provenance."
        },
        "contaminating_providers": {
          "type": "array",
          "items": {"type": "string", "minLength": 1},
          "description": "Providers that helped build this truth and therefore cannot be scored against it without declaring the dependency. Machine-readable so a scoring run can refuse the combination instead of relying on someone having read the notes. Required once any target is machine-assisted."
        }
      }
    },
    "rights": {
      "type": "object",
      "additionalProperties": false,
      "required": [
        "copyright_holder",
        "license",
        "license_url",
        "local_processing",
        "redistribution",
        "review_notes",
        "accessed_at"
      ],
      "properties": {
        "copyright_holder": {"type": "string", "minLength": 1},
        "license": {"type": "string", "minLength": 1},
        "license_url": {
          "type": ["string", "null"],
          "format": "uri",
          "description": "URL of the license document, or null when the source is all-rights-reserved and no license document exists."
        },
        "local_processing": {"type": "string", "enum": ["permitted", "restricted", "unknown"]},
        "redistribution": {"type": "string", "enum": ["permitted", "restricted", "unknown"]},
        "review_notes": {"type": "string", "minLength": 1},
        "accessed_at": {"type": "string", "format": "date"}
      }
    },
    "selection": {
      "type": "object",
      "additionalProperties": false,
      "required": ["r0_status", "diagnostic_value", "risks"],
      "properties": {
        "r0_status": {"type": "string", "enum": ["recommended", "alternate", "rejected"]},
        "diagnostic_value": {"type": "string", "minLength": 1},
        "risks": {"type": "array", "items": {"type": "string", "minLength": 1}}
      }
    }
  },
  "$defs": {
    "truthThread": {
      "type": "object",
      "additionalProperties": false,
      "required": ["label", "first_anchor_ms", "last_anchor_ms", "evidence"],
      "properties": {
        "label": {"type": "string", "minLength": 1},
        "first_anchor_ms": {
          "type": "integer",
          "minimum": 0,
          "description": "Where the thread opens. Must be the anchor_ms of a truth target in this manifest."
        },
        "last_anchor_ms": {
          "type": "integer",
          "minimum": 0,
          "description": "Where the thread is last carried. Must be the anchor_ms of a truth target in this manifest, and later than first_anchor_ms."
        },
        "evidence": {
          "type": "string",
          "minLength": 1,
          "description": "What is observable at each end and what makes them the same thread. A pair of anchors that merely mention a word is a word frequency, not a thread; what is claimed here is that the later moment is about the earlier one."
        }
      }
    },
    "truthTarget": {
      "type": "object",
      "additionalProperties": false,
      "required": ["label", "kind", "status"],
      "properties": {
        "label": {"type": "string", "minLength": 1},
        "kind": {
          "type": "string",
          "enum": ["person", "character", "place", "faction", "item", "quest", "event"],
          "description": "person is a physical speaker at the table; character is the fiction they voice. The two are deliberately separate kinds."
        },
        "status": {"type": "string", "enum": ["provisional", "verified"]},
        "evidence": {"type": "string"},
        "anchor_ms": {
          "type": "integer",
          "minimum": 0,
          "description": "Where the target is observable, in milliseconds on the same basis as the excerpt window. Must fall inside that window."
        },
        "basis": {
          "type": "string",
          "enum": ["audio_observed", "audio_machine_assisted", "metadata_inferred"],
          "description": "How the target was found, named for the strongest evidence behind it. audio_observed means a person listened to the recording and heard it - this is the human-ear value, and nothing weaker may use it. audio_machine_assisted means the recording was read through tooling, which is verifiable but carries a dependency on whatever produced the reading. metadata_inferred came from a title, description, or index, and cannot be scored as capability. Only the first two can be verified. A target first read by tooling and later confirmed by ear becomes audio_observed, and its evidence says both things happened, because one field cannot carry a history. A spelling settled from a written source is not an ear observation: the audio establishes the word, the source establishes how it is written, and the evidence has to say which did which."
        }
      }
    }
  }
}
