{
  "schema_version": "0.1",
  "id": "critical-role-c3e01-jrusar-introductions",
  "title": "Critical Role C3E1: Jrusar and first character introductions",
  "corpus_tier": "polished_professional",
  "source": {
    "landing_url": "https://critrole.com/critical-recap-critical-role-c3e1-the-draw-of-destiny/",
    "media_url": "https://www.youtube.com/watch?v=P8pLvV3FjPc",
    "publisher": "Critical Role",
    "published_at": "2021-10-21",
    "accessed_at": "2026-07-24",
    "episode_duration_ms": 14304000
  },
  "excerpt": {
    "start_ms": 785000,
    "end_ms": 1230000,
    "timestamp_basis": "third_party_index",
    "verification": "Omen Archive indexes the YouTube episode start at 00:13:05 and the first Imogen and Laudna introductions at 00:18:10 and 00:19:10; the official recap and video resolve."
  },
  "recording_conditions": {
    "capture_layout": "studio_multimic",
    "production": "polished",
    "expected_physical_speakers": 9,
    "overlap": "low",
    "music_or_effects": true,
    "observations": "Professional studio actual play with close microphones, a narrated setting introduction, fantasy names, and sequential player introductions."
  },
  "references": {
    "caption_or_transcript": "community",
    "reference_url": "https://criticalrole.fandom.com/wiki/Transcript:The_Draw_of_Destiny",
    "speaker_labels": true,
    "annotation_status": "provisional"
  },
  "truth": {
    "important_entities": [
      {"label": "Jrusar", "kind": "place", "status": "provisional"},
      {"label": "Imogen Temult", "kind": "character", "status": "provisional"},
      {"label": "Laudna", "kind": "character", "status": "provisional"}
    ],
    "important_events": [
      {
        "label": "The setting of Jrusar is established and Imogen and Laudna are introduced.",
        "kind": "event",
        "status": "provisional"
      }
    ],
    "notes": "Targets come from the official recap/cast metadata and community timestamp index; B02 must verify them against the media before scoring."
  },
  "rights": {
    "copyright_holder": "Critical Role Productions, LLC",
    "license": "All rights reserved; no benchmark redistribution permission identified",
    "license_url": "https://www.youtube.com/static?template=terms",
    "local_processing": "unknown",
    "redistribution": "restricted",
    "review_notes": "Keep as a streaming/reference alternate. Do not automate download or redistribute audio without a reviewed permission or legal basis.",
    "accessed_at": "2026-07-24"
  },
  "selection": {
    "r0_status": "alternate",
    "diagnostic_value": "A clean professional baseline with dense invented geography and character names contrasts with the noisier archived podcast candidate.",
    "risks": [
      "Local download/processing permission is not established.",
      "Community transcript and timestamps are useful navigation aids but not verified truth.",
      "Studio audio does not represent the target single-room capture."
    ]
  }
}
