{
  "schema_version": "0.1",
  "id": "synthetic-example-session",
  "title": "Synthetic Example Session (fixture; no recording exists)",
  "corpus_tier": "amateur_online",
  "source": {
    "landing_url": "https://example.invalid/synthetic-example-session",
    "media_url": "https://example.invalid/synthetic-example-session.mp3",
    "publisher": "RPG Chronicle test fixture",
    "published_at": "2026-07-27",
    "accessed_at": "2026-07-27",
    "episode_duration_ms": 3600000,
    "media_bytes": 127266240,
    "media_sha256": "0000000000000000000000000000000000000000000000000000000000000000"
  },
  "excerpt": {
    "start_ms": 0,
    "end_ms": 600000,
    "timestamp_basis": "published_media_file",
    "verification": "Invented for tests; no recording exists."
  },
  "recording_conditions": {
    "capture_layout": "single_mixed_track",
    "production": "raw",
    "expected_physical_speakers": 7,
    "proven_distinct_speakers": null,
    "overlap": "medium",
    "music_or_effects": true,
    "observations": "Invented fixture value."
  },
  "references": {
    "caption_or_transcript": "none",
    "speaker_labels": false,
    "annotation_status": "verified"
  },
  "truth": {
    "method": "Authored by hand as a test fixture. No recording was consulted.",
    "contaminating_providers": [
      "example-engine-v1"
    ],
    "important_entities": [
      {
        "label": "Alder",
        "kind": "person",
        "status": "verified",
        "anchor_ms": 60000,
        "basis": "audio_observed",
        "evidence": "Invented fixture datum; nothing was heard."
      },
      {
        "label": "Brindle",
        "kind": "character",
        "status": "verified",
        "anchor_ms": 480000,
        "basis": "audio_observed",
        "evidence": "Invented fixture datum; nothing was heard."
      }
    ],
    "important_events": [
      {
        "label": "The bridge is crossed",
        "kind": "event",
        "status": "verified",
        "anchor_ms": 300000,
        "basis": "audio_observed",
        "evidence": "Invented fixture datum; nothing was heard."
      }
    ],
    "notes": "Every value here is invented, to exercise the validator.",
    "threads": []
  },
  "rights": {
    "copyright_holder": "None; this manifest describes no real work",
    "license": "Not applicable - synthetic fixture",
    "license_url": "https://example.invalid/license",
    "local_processing": "permitted",
    "redistribution": "permitted",
    "review_notes": "Fixture manifest. It describes no recording, so no rights attach.",
    "accessed_at": "2026-07-27"
  },
  "selection": {
    "r0_status": "recommended",
    "diagnostic_value": "Invented fixture value.",
    "risks": [
      "Invented fixture value.",
      "Invented fixture value.",
      "Invented fixture value.",
      "Invented fixture value."
    ]
  }
}
